Id,Unknown0,Unknown1,Unknown2,Unknown3,Unknown4,Unknown5,Unknown6,Unknown7,Unknown8
"1255","Defeat the bosses of the Shadowmoon Burial Grounds","Shadowmoon Burial Grounds","37361","687","0","35963","0","0","0"
"1256","Defeat the Adherents of Rukhmar atop Skyreach.","Skyreach","37366","688","0","35961","0","0","0"
"1257","Defeat the Adherents of Rukhmar atop Skyreach.","Skyreach","37371","689","0","35963","0","0","0"
"1264","The timer should start here.","Start Timer","37401","696","0","0","0","0","0"
"1265","Move ahead through the Warsong onslaught. Regroup with the Alliance forces up the path and speak with Vindicator Yrel.","Survive the Gauntlet","37403","508","0","0","3","0","0"
"1266","Move ahead through the Warsong onslaught. Regroup with the Horde forces up the path and speak with Durotan.","Survive the Gauntlet","37405","509","0","0","3","0","0"
"1269","Gather the Alliance forces at the first bend up ahead and strategize with Rangari D'kaan.","Gather at the Bend","37444","508","0","0","1","0","0"
"1270","Gather the Horde forces at the first bend up ahead and strategize with Aggra.","Regroup at the Bend","37450","509","0","0","1","0","0"
"1271","Speak with Vindicator Yrel at the gates to the Grommashar Throne.","The Final Gates","37452","508","0","0","5","0","0"
"1272","Speak with Durotan at the gates to the Grommashar Throne.","The Final Gates","37454","509","0","0","5","0","0"
"1321","Follow the Sergeant.","Invasion","37501","704","0","0","0","0","0"
"1322","Defeat the Iron Horde scouting party.","The Scouting Party","37503","704","0","0","1","0","0"
"1323","Endure the Iron Horde assault.","Hold Out!","37505","704","0","0","2","0","0"
"1324","Return to the town center.","The Calm","37508","704","0","0","4","0","0"
"1325","Defeat the Iron Horde commander.","Commander's Fall","37510","704","0","0","5","0","0"
"1326","Bronze: Earn 300 Points","Bronze","37512","704","0","0","6","1","0"
"1327","Silver: Earn 600 Points","Silver","37514","704","1326","0","7","1","0"
"1328","Gold: Earn 1000 Points","Gold","37516","704","1327","0","8","1","0"
"1329","","Never ending step","37518","705","0","0","0","0","0"
"1330","Kill 10 Orcs","Progressive Bonus 1","37520","705","0","0","1","1","0"
"1331","Kill 20 Orcs","Progressive Bonus 2","37522","705","1330","0","2","1","0"
"1332","Kill 30 Orcs","Progressive Bonus 3","37524","705","1331","0","3","1","0"
"1341","Follow the Sergeant","Invasion!","37526","707","0","0","0","0","0"
"1342","Defeat the Lashers","Ambush","37528","707","0","0","1","0","0"
"1343","Endure the Primals' assault.","The Holdout","37493","707","0","0","2","0","0"
"1344","Return to the town center.","The Calm","37496","707","0","0","4","0","0"
"1345","Defeat the Ancient and its tenders.","The Forest Walks","37498","707","0","0","5","0","0"
"1346","Bronze: Earn 300 Points","Bronze","37530","707","0","0","6","1","0"
"1347","Silver: Earn 600 Points","Silver","37532","707","1346","0","7","1","0"
"1348","Gold: Earn 1000 Points","Gold","37534","707","1347","0","8","1","0"
"1349","Investigate the overgrown Kirin Tor outpost.","The Everbloom","37735","708","0","35962","0","0","0"
"1350","Defeat Xeri'tek","Bonus Objective","37740","708","0","36277","1","1","0"
"1351","Investigate the overgrown Kirin Tor outpost.","The Everbloom","37742","709","0","35963","0","0","0"
"1352","Defeat Xeri'tek","Bonus Objective","37747","709","0","36277","1","1","0"
"1364","Follow the Sergeant","Invasion!","38004","715","0","0","0","0","0"
"1365","Defeat the invaders","Ambush","38006","715","0","0","1","0","0"
"1366","Endure the Shadowmoon assault.","The Holdout","38008","715","0","0","2","0","0"
"1367","Return to the town center.","The Calm","38011","715","0","0","4","0","0"
"1368","Defeat the Void Spawn.","Shadows Gather","38015","715","0","0","5","0","0"
"1369","Bronze: Earn 300 Points","Bronze","38017","715","0","0","6","1","0"
"1370","Silver: Earn 600 Points","Silver","38019","715","1369","0","7","1","0"
"1371","Gold: Earn 1000 Points","Gold","38021","715","1370","0","8","1","0"
"1381","Confront Commander Gar.","The Confrontation","38087","723","0","0","0","0","0"
"1382","Use the artifact to eliminate your enemies.","Harnessing the Power","38089","723","0","0","1","0","0"
"1383","Defeat the incoming enemies using the power of the artifact.","Bolstering their Forces","38091","723","0","0","2","0","0"
"1384","Defeat Goc.","The Son of Gruul","38093","723","0","0","3","0","0"
"1385","Defeat Commander Gar.","The Final Confrontation","38095","723","0","0","4","0","0"
"1386","Follow the Sergeant","Invasion!","38537","724","0","0","0","0","0"
"1387","Defeat the assault","Assault","38539","724","0","0","1","0","0"
"1388","Endure the ogre onslaught.","The Holdout","38541","724","0","0","2","0","0"
"1389","Go to the town center.","The Calm","38544","724","0","0","4","0","0"
"1390","Defeat the Gorian Champion.","A Challenger Appears","38546","724","0","35914","5","0","0"
"1391","Bronze: Earn 300 Points","Bronze","38548","724","0","0","6","1","0"
"1392","Silver: Earn 600 Points","Silver","38550","724","1391","0","7","1","0"
"1393","Gold: Earn 1000 Points","Gold","38552","724","1392","0","8","1","0"
"1403","Kill inhabitants of rooms to extinguish runes.","Extinguish Runes","38797","731","0","0","0","0","0"
"1405","Defeat the Ironmarch forces occupying the halls of the Spire.","Upper Blackrock Spire","38793","731","0","36865","1","0","0"
"1408","Follow the Sergeant","Invasion!","38848","733","0","0","0","0","0"
"1409","Defeat the assault","Assault","38850","733","0","0","1","0","0"
"1410","Hold against the Shadow Council","The Holdout","38852","733","0","0","2","0","0"
"1411","Go to the Town Center.","The Calm","38855","733","0","0","4","0","0"
"1412","Defeat the Abyssal Invader.","Fire from the Skies","38857","733","0","0","5","0","0"
"1413","Bronze: Earn 300 Points","Bronze","38859","733","0","0","6","1","0"
"1414","Silver: Earn 600 Points.","Silver","38861","733","1413","0","7","1","0"
"1415","Gold: Earn 1000 Points","Gold","38863","733","1414","0","8","1","0"
"1416","Defeat the bosses of Lower Blackrock Spires","Lower Blackrock Spires","38891","734","0","36866","0","0","0"
"1417","Urok Doomhowl defeated","Bonus Objective","38896","734","0","36867","1","1","0"
"1421","Gazlowe and Thaelin have repaired an Iron Star that can take you to the harbor.","The Iron Star","39059","331","0","0","1","0","0"
"1422","Slay all opposing gladiators","Fight, Kill, Salute","39349","736","0","0","2","0","0"
"1426","Take the elevator to the arena","A Gladiator's Welcome","39868","736","0","0","0","0","0"
"1427","Prepare for battle","My Name is Gladiator","39911","736","0","0","1","0","0"
"1436","Follow the Sergeant","Invasion","40173","742","0","0","0","0","0"
"1437","Defeat the Iron Horde scouting party.","The Scouting Party","40175","742","0","0","1","0","0"
"1438","Endure the Iron Horde assault.","Hold Out!","40177","742","0","0","2","0","0"
"1439","Return to the town center.","The Calm","40180","742","0","0","4","0","0"
"1440","Defeat the Iron Horde commander.","Commander's Fall","40182","742","0","35914","5","0","0"
"1446","Kill inhabitants of rooms to extinguish runes.","Extinguish Runes","40327","744","0","0","0","0","0"
"1447","Defeat the Ironmarch forces occupying the halls of the Spire.","Upper Blackrock Spire","40329","744","0","35962","1","0","0"
"1448","Follow the Sergeant","Invasion!","40697","745","0","0","0","0","0"
"1449","Defeat the invaders","Ambush","40699","745","0","0","1","0","0"
"1450","Endure the Shadowmoon assault.","The Holdout","40701","745","0","0","2","0","0"
"1451","Return to the town center.","The Calm","40704","745","0","0","4","0","0"
"1452","Defeat the Void Spawn.","Shadows Gather","40706","745","0","35914","5","0","0"
"1459","Defeat the remaining Iron Horde forces.","Cleanup","41382","704","0","0","3","0","0"
"1460","Defeat the remaining Shadowmoon forces.","Cleanup","41384","715","0","0","3","0","0"
"1461","Defeat the remaining Shadow Council forces","Cleanup","41386","733","0","0","3","0","0"
"1462","Defeat the remaining Gorian forces.","Cleanup","41388","724","0","0","3","0","0"
"1463","Defeat the remaining Botani forces.","Cleanup","41390","707","0","0","3","0","0"
"1464","Defeat the remaining Goren forces.","Cleanup","41392","499","0","0","3","0","0"
"1465","Defeat the remaining Thunderlord forces.","Cleanup","41394","742","0","0","3","0","0"
"1467","Defeat the remaining Shadowmoon forces.","Cleanup","41531","745","0","0","3","0","0"
"1485","Destroy the demon army.","Crusaders' March","42486","775","0","0","1","0","0"
"1486","Destroy Jailer Zerus and save Highlord Tirion Fordring.","Holy Vengeance","45098","775","0","0","2","0","0"
"1487","Find the Ashbringer within the Lost Temple.","The Ashbringer","45145","775","0","0","3","0","0"
"1488","Lead the paladins of the Argent Crusade into battle.","Sounding the Charge","42545","775","0","0","0","0","0"
"1495","Drive back the fel invaders. #1","Felfire in the Sky #1","42788","785","0","0","0","0","0"
"1497","Defeat Lord Jaraxxus.","You Face Jaraxxus","42790","785","0","0","1","0","0"
"1498","","Platinum","42714","715","1371","0","9","1","0"
"1499","Platinum: Earn 1300 Points","Platinum","42716","704","1328","0","9","1","0"
"1500","Platinum: Earn 1300 Points","Platinum","42718","724","1393","0","9","1","0"
"1501","Platinum: Earn 1300 Points","Platinum","42720","707","1348","0","9","1","0"
"1502","Platinum: Earn 1300 Points","Platinum","42722","733","1415","0","9","1","0"
"1503","Platinum: Earn 1300 Points","Platinum","42724","499","1198","0","9","1","0"
"1504","Travel to the Broken Shore.","The Broken Shore","42768","786","0","0","0","0","0"
"1505","Assault the demon city.","Raze the Black City","42770","786","0","0","5","0","0"
"1506","Get to Tirion.","The Highlord","42772","786","0","0","6","0","0"
"1518","Slay Runas the Shamed.","As Two-Faced As They Come","42883","795","0","0","6","0","0"
"1522","Destroy all demons and structures on the beach.","Storm The Beach","42935","786","0","0","1","0","0"
"1526","Speak with Senegos.","Tides of Glory","43121","795","0","0","1","0","0"
"1527","Protect the Tidestone from the naga.","The Tidestone's Call","43015","795","0","0","2","0","0"
"1528","Slay Majh'Tua and Deeplord Havocbrine.","The Siegebreakers","43011","795","0","0","3","0","0"
"1529","Slay the nightfallen that are feeding on the Tidestone.","Feeding on the Tidestone","43013","795","0","0","4","0","0"
"1530","Protect the Tidestone from the withered.","The Hunger","43019","795","0","0","5","0","0"
"1531","Dispel the naga scouting party.","Wait For Players","46864","795","0","0","0","0","0"
"1532","Destroy the demon portal to stop reinforcements.","Destroy the Portal","43415","786","0","0","4","0","0"
"1539","Defend against the Legion threat at Gadgetzan.","Defend Gadgetzan","48088","806","0","43293","0","0","0"
"1559","Man the Deck Guns","Prepare for Battle","43519","826","0","0","0","0","0"
"1560","Use the Deck Guns to shoot down Forsaken Dreadwings","Fire at Will!","43521","826","0","0","1","0","0"
"1568","Head below decks and use a Skyfire Parachute to board the Forsaken ships and defeat their captains.","Justice from Above","43564","826","0","0","2","0","0"
"1572","Remove Volatile Flares from Skyfire bomb bay.","Bats in the Bomb Bay","43587","826","0","0","3","0","0"
"1589","Locate King Varian Wrynn.","Find Varian","43589","786","0","0","3","0","0"
"1695","Defeat Nathanos Blightcaller on the deck of the Skyfire.","Last Stand","43617","826","0","39800","4","0","0"
"1752","Quell the Infernal Uprising on Kirin Tor Shore.","Pushing Them Back","43677","873","0","0","0","0","0"
"1753","Close the Demon Portals.","Suppressing the Source","43679","873","0","0","1","0","0"
"1754","Defend the research station from the Fel Lord.","Defend the Outpost","43681","873","0","0","2","0","0"
"1758","Legion Activities Disrupted","Push Back the Legion Assault","43683","876","0","0","0","0","0"
"1761","Kill Krosus.","Krosus","43765","786","0","0","7","0","0"
"1790","Report to Lady Sylvanas Windrunner.","The Windrunner","43801","824","0","0","0","0","0"
"1791","Ride with Nathanos to the Eternity and use a Forsaken Catapult to shoot down Skyfire Gryphon Riders.","The Eternity","43803","824","0","0","1","0","0"
"1792","Ride with Nathanos to the Blightcaller and slay incoming 7th Legion forces.","The Blightcaller","43841","824","0","0","2","0","0"
"1793","Ride with Nathanos to the Black Rose and rid the ship of worgen.","The Black Rose","43843","824","0","0","3","0","0"
"1794","Ride with Nathanos to the Skyfire and rig Volatile Flares to the ammunition stockpiles.","Boarding the Skyfire","43845","824","0","0","4","0","0"
"1795","Battle Genn Greymane on the deck of the Skyfire.","Queen Takes King","43847","824","0","39801","5","0","0"
"1799","Defend against the Legion threat at the Sentinel Hill.","Defend Sentinel Hill","43889","897","0","43287","0","0","0"
"1808","Fly into Felsoul Hold.","Stalking Your Prey","44016","900","0","0","0","0","0"
"1809","The Lich King awaits your return to the citadel.","The Call of the North","44180","901","0","0","0","0","0"
"1810","Collect Fragments within Icecrown Citadel.","Seek the Fragments","44039","901","0","0","2","0","0"
"1811","Use the Scourge Teleporter within the Spire.","Travel to the Frozen Throne","44045","901","0","0","3","0","0"
"1812","Reforge the fragments and form your weapon.","Power Overwhelming","44057","901","0","0","4","0","0"
"1814","Purge the blades of the malevolent souls within.","The Purge","44051","901","0","0","5","0","0"
"1819","Defeat the Demon Lord commanding the invasion.","Defeat the Demon Lord","44105","897","0","43245","3","0","0"
"1821","Dive into the fray.","They Are Not Prepared","44321","900","0","0","1","0","0"
"1822","Destroy the wards protecting Varedis and absorb the souls of his minions.","Wrath of the Illidari","44323","900","0","0","2","0","0"
"1825","Kill Varedis Felsoul.","Unleashed Havoc","44331","900","0","0","3","0","0"
"1826","","Show Faction Specific Criteria","44372","908","0","0","0","0","0"
"1827","Obtain the Lich King's Blessing.","Death's March","44378","901","0","0","7","0","0"
"1828","Defeat the Legion forces.","The Disturbance","45337","909","0","0","1","0","0"
"1829","Find Magnar's resting place within the tomb.","Crypt Crawl","44568","909","0","0","2","0","0"
"1830","Defend Hruthnir from Magnar's forces.","The Confrontation","44570","909","0","0","3","0","0"
"1833","The sword and shield are yours, claim them.","Armaments of the Black Wyrm","44572","909","0","0","5","0","0"
"1834","Defeat Dargrul's legions and recover the Hammer of Khaz'goroth before Highmountain is destroyed.","Neltharion's Lair","44595","910","0","44437","0","0","0"
"1835","You made it through the Portal","Safe Entrance","44681","911","0","0","0","0","0"
"1836","Steal food from the three storage locations and three Wyrmtogue Meatholders in the city below.","Obtain the Bait","44974","911","0","0","1","0","0"
"1837","Head out to the back and place the bait.","Place the Bait","0","911","0","0","2","0","0"
"1838","","Slay the Hound","0","911","0","0","3","0","0"
"1839","Retrieve the Fangs and Return to Dalaran.","Retrieve the Fangs","0","911","0","0","4","0","0"
"1843","Defend against the Legion threat at Tarren Mill.","Defend Tarren Mill","49508","916","0","43296","0","0","0"
"1844","Defeat the demon lord commanding the invasion at the Crossroads.","Defeat the Demon Lord","47042","907","0","43282","3","0","0"
"1847","Enter the Eye of Azshara and stop the Wrath of Azshara from being unleashed upon the Broken Isles.","Eye of Azshara","45914","918","0","44437","0","0","0"
"1849","Enter the Eye of Azshara and stop the Wrath of Azshara from being unleashed upon the Broken Isles.","Eye of Azshara","45090","920","0","44437","0","0","0"
"1853","Defeat Balnazzar.","Balnazzar the Risen","45269","775","0","0","5","0","0"
"1854","Return to Tirion Fordring.","The Fate of the Highlord","45277","775","0","0","6","0","0"
"1856","Find Magnar's Tomb with Hruthnir.","The Sealed Tomb","45335","909","0","0","0","0","0"
"1861","Prove your worth and claim the Aegis of Aggramar.","Halls of Valor","45722","929","0","44437","0","0","0"
"1867","Prove your worth and claim the Aegis of Aggramar.","Halls of Valor","45732","932","0","44437","0","0","0"
"1869","Defeat Magnar Icebreaker.","The Greatest Warrior","45762","909","0","0","4","0","0"
"1870","A strange group of vrykul are here battling demons. They don't seem hostile. Approach them and learn their purpose.","Another Battle","45768","933","0","0","0","0","0"
"1871","Another group of demons is attacking, aid the warband in crushing these foes.","A Desperate Charge","45770","933","0","0","1","0","0"
"1872","Demonic reinforcements approach with a large mo'arg. Defeat Bezzeredes and his allies.","Reinforcing the Warband","45772","933","0","0","3","0","0"
"1873","Malgalor, Lord of Butchery has arrived to kill everyone. Stand with what remains of the warband. Kill Malgalor or die trying.","Just A Pit Lord","45776","933","0","0","4","0","0"
"1884","Baron Sliver should have already arrived. Search for him.","Hunting the Hunters","45809","940","0","0","0","0","0"
"1886","Defeat Dargrul's legions and recover the Hammer of Khaz'goroth before Highmountain is destroyed.","Neltharion's Lair","45818","942","0","44437","0","0","0"
"1887","The masters of the Peak of Serenity have gathered for a conclave.","The Council of Masters","45900","943","0","0","0","0","0"
"1888","The village is shrouded in mists. Light the bonfire to clear it and provoke the Helarjar.","Into the Mists","45848","944","0","0","0","0","0"
"1889","The kvaldir are enraged at the loss of the mists. Survive their assault until the commanding helarjar arrives, then kill him.","Village of the Damned","45860","944","0","0","1","0","0"
"1891","Vigfus continues to ignore your presence. Free his cargo of souls to draw him out.","The Stolen Souls","45862","944","0","0","3","0","0"
"1892","Legion Activities Disrupted","Push Back the Legion Assault","45864","945","0","0","0","0","0"
"1896","Rescue Master Crane","The Cry of the Crane","45841","943","0","0","1","0","0"
"1897","With Master Crane's help, reach the west temple grounds","Journey to the East","45902","943","0","0","2","0","0"
"1898","Chen Stormstout was leading a children's class when the attack began. Rescue him and the children!","Tangle with a Tiger","45904","943","0","0","3","0","0"
"1899","Accompany Chen and the children back to the Temple.","Precious Cargo","45906","943","0","0","4","0","0"
"1900","The Demon known as Jorvinax has opened a gigantic portal! You must close it before the Legion can turn the Peak of Serenity into a foothold.","Mastering the Odds","45908","943","0","0","5","0","0"
"1901","With Jorvinax dead the portal is left unguarded. Find a way to destroy it!","Portal Problems","45910","943","0","0","6","0","0"
"1902","Follow Geth'xun's trail of fel blood.","Demon Down","45912","950","0","0","0","0","0"
"1905","Defeat the devouring imps.","Corruption in the Deep","45920","950","0","0","1","0","0"
"1906","Follow Geth'xun's trail of fel blood.","Hot on the Trail","45922","950","0","0","2","0","0"
"1907","Defeat the Corrupted Gyreworm.","Cleansing the Earth","45928","950","0","0","3","0","0"
"1908","Follow the trail to find Geth'xun.","The Demon Below","45930","950","0","0","4","0","0"
"1909","Acquire the Doomhammer!","The Doomhmamer Calls","45932","950","0","0","5","0","0"
"1910","Use the Doomhammer to destroy Geth'xun.","Finishing the Job","45934","950","0","0","6","0","0"
"1911","Help Stormcaller Mylra.","A Ring Eternal","45936","950","0","0","7","0","0"
"1912","The Bladewind has made an appearance. Slay him!","Vigfus Himself","45948","944","0","0","4","0","0"
"1913","The Bladewind is escaping into the shallows, find and kill him.","On The Trail","45950","944","0","0","5","0","0"
"1914","The Warswords of the Bladewind are yours. Take them.","The Warswords","45952","944","0","0","6","0","0"
"1919","Legion Activities Disrupted","Push Back the Legion Assault","45954","955","0","0","0","0","0"
"1926","Defeat the Iceborn Conjurer.","The Frozen Halls","45956","957","0","0","0","0","0"
"1927","The servants of the Lich King have conjured walls of ice to block your path. Destroy them.","Meltdown","45960","957","0","0","1","0","0"
"1928","Survive the assault of the burning dead.","Hot On The Trail","45962","957","0","0","2","0","0"
"1929","Slay Lyandra Sunstrider.","Playing With Fire","45964","957","0","0","3","0","0"
"1930","Felo'melorn is yours. Take it.","The Flamestrike","45966","957","0","0","4","0","0"
"1931","Defend against the Legion threat at the Orgrimmar Rear Gate.","Defend the Rear Gate","50193","958","0","43298","0","0","0"
"1932","Defend against the Legion threat at Kharanos.","Defend Kharanos","49069","959","0","43291","0","0","0"
"1939","Free Allari from her chains.","Picking Up the Pieces","45975","961","0","0","0","0","0"
"1940","Cut through the demon hordes and destroy their portals.","Their Blood Will Flow","45977","961","0","0","1","0","0"
"1941","Use your demonic senses to pickup Caria's trail.","Nowhere to Hide","45979","961","0","0","4","0","0"
"1942","Caria Felsoul's time has come.","Vengeance for the Illidari","45981","961","0","0","5","0","0"
"1943","Vigfus and his souls are below, kill the mystics defending the path down and reach the docks.","Deeper Into the Fog","45983","944","0","0","2","0","0"
"1944","Listen to Ritssyn.","Far From Home","46003","962","0","0","0","0","0"
"1945","Enslave the jailer Beshtal to free yourself from his cage, then defeat him with Ritssyn's aid.","The Dread Warden","46005","962","0","0","1","0","0"
"1947","","A Final Step","31016","908","0","0","1","0","0"
"1948","Gorgonnash has risen to stop your assault.","In the Darkness of the Pit","46015","961","0","0","3","0","0"
"1949","Rescue Jubeka Shadowbreaker, Zinnin Smythe, and Shinfel Blightsworn.","The Shattered Council","46020","962","0","0","2","0","0"
"1950","Follow Calydus to the archives to uncover information about the artifacts Jagganoth hunts.","The Pit Lord's Secrets","46018","962","0","0","4","0","0"
"1952","Follow Calydus to escape from Dreadscar Rift.","To Fight Another Day","46063","962","0","40729","5","0","0"
"1953","Meet with Calydus on the bridge past the fel flame barrier.","Jailbreak","46042","962","0","0","3","0","0"
"1959","Explore the sprawling depths of The Arcway.","The Arcway","46065","967","0","44437","0","0","0"
"1961","Legion Commander Defeated","Defeat the Legion Commander","46079","955","0","0","1","0","0"
"1965","Wuho should have located a good spot to start. Wait for his signal, then regroup at the landing site.","Landing","46178","973","0","0","0","0","0"
"1967","Kvaldir wards bar the way further into the swamp. Investigate Tideskorn Harbor to find a way through.","The Haunted Harbor","46182","973","0","0","1","0","0"
"1968","The Mist Warders manage the wards. Use a Freezing Trap or slay them to steal their wardstones.","Distracting Them Wisely","46184","973","0","0","2","0","0"
"1969","More wardstones will be needed to breach the wall. Collect more wardstones from the kvaldir in the harbor.","Just a Few More","46186","973","0","0","4","0","0"
"1970","Apata and Wuho are out near the wards, find them and find a way to breach the wards.","The Wall of Fog","46220","973","0","0","5","0","0"
"1971","Harpoons and runes in hand, the fog barrier can be breached. Use a harpoon to cross the wards.","Into the Mists","46222","973","0","0","6","0","0"
"1973","Enter Icecrown Citadel.","The Gates Are Open","46224","901","0","0","1","0","0"
"1974","Apata wants to get the lay of the land carefully, follow her around the swamp.","The Shallows of Death","46240","973","0","0","7","0","0"
"1976","Dakarr is sending illusionary stalkers at you, defend yourself!","Deadly Shadows","46246","973","0","0","8","0","0"
"1977","Dakarr hides in deep mists, go into them and lay traps to catch him.","The Hunter or the Hunted","46248","973","0","0","9","0","0"
"1985","The beast has fled to another lair of mist, trap it again and avenge Wuho.","For the Fallen","46287","973","0","0","10","0","0"
"1986","Dakarr has fled to his true lair, but is too weak to hide behind fog. Finish him in his lair.","The Lair of the Beast","46289","973","0","0","11","0","0"
"1987","The foul beast is dead and the path to the Spear is open. Take up Talonclaw.","Talonclaw","46291","973","0","0","12","0","0"
"1988","Survey the rise ahead and eliminate Legion patrols.","The Rescue","46361","972","0","0","0","0","0"
"1992","Speak with the White Tiger.","Proving Your Worth","46300","976","0","0","0","0","0"
"1993","Challenge and triumph over Sigurd the Giantslayer.","Defeat the Giantslayer","46302","976","0","0","1","0","0"
"1994","Defeat the forces of Xavius at the base of Shaladrassil.","Darkheart Thicket","46304","977","0","44437","0","0","0"
"1995","Defeat the forces of Xavius at the base of Shaladrassil.","Darkheart Thicket","46310","978","0","44437","0","0","0"
"1999","Earn a team victory with Rehgar.","Heroes of the Storm","46335","976","0","0","2","0","0"
"2000","Defeat the eredar summoners before they bring in more demons.","Stop the Summoners","46326","972","0","0","1","0","0"
"2001","Go deeper into Legion territory to locate Alleria and Orestes.","Search for Your Allies","46435","972","0","0","2","0","0"
"2002","Slay Mistress Torvis and save Orestes.","Defeat the Hound Mistress","46340","972","0","0","3","0","0"
"2006","Follow Li Li and protect her from the dangers of Skywall.","Into the Skies","46363","983","0","0","0","0","0"
"2007","Your foes are using the Stormtouched Orbs to empower themselves. Destroy the orbs and break through the Raging Winds.","A Shocking Development","46367","983","0","0","2","0","0"
"2008","Typhinius has summoned his servants, survive the assault!","Against The Storm","46392","983","0","0","3","0","0"
