Id,Unknown0,Unknown1,Unknown2,Unknown3,Unknown4,Unknown5,Unknown6,Unknown7,Unknown8
"863","Protect K'ara until it becomes fully empowered.","Protect K'ara from the invading forces","35591","449","0","0","2","0","0"
"864","Follow Prophet Velen.","A Vision Revealed","35613","450","0","0","0","0","0"
"865","Witness Commander Vorka's arrival.","Commander Vorka","35615","450","0","0","2","0","0"
"866","Defeat Krull.","Enemy Onslaught","35628","450","0","0","1","0","0"
"868","Speak to Prophet Velen on the Karabor stairs.","The Final Defense","35631","450","0","0","3","0","0"
"873","Stop the Bombardment of Karabor!","Kill Commander Vorka!","35704","449","0","0","3","0","0"
"884","Defeat Subjugator Kor'ul","Bonus Objective","35745","333","0","35930","2","1","0"
"885","Defeat the Guardian of the Deep","Bonus Objective","35747","333","0","35930","3","1","0"
"895","Help defeat Blackhand on the Iron Horde's flagship.","Blackhand","36023","331","0","0","5","0","0"
"914","Endure the Goren Assault.","The Holdout","36131","499","0","0","2","0","0"
"915","Defeat the Gronn.","It is Near","36133","499","0","35914","5","0","0"
"920","Defeat the Goren Ambush.","Ambush","36137","499","0","0","1","0","0"
"928","Follow the Sergeant","Invasion!","36157","499","0","0","0","0","0"
"929","Speak with Vindicator Yrel to begin the Alliance's assault upon Grommashar.","Launch the Attack","37446","508","0","0","0","0","0"
"930","The might of the Warsong clan rests in their wolfriders. Flank the packmaster and the core of the clan's power will crumble.","Defeat the Packmaster","36375","508","0","0","2","0","0"
"931","Thunderlord clan members of the Iron Horde have enslaved the mighty gronn, Durn the Hungerer. Slay him.","Slay Durn the Hungerer","36377","508","0","0","4","0","0"
"932","The time has come for you and Vindicator Yrel to confront Warlord Garrosh Hellscream.","Confront Warlord Garrosh Hellscream","36379","508","0","0","6","0","0"
"933","Speak with Durotan to begin the Horde's assault upon Grommashar.","Launch the Attack","37448","509","0","0","0","0","0"
"934","The might of the Warsong clan rests in their wolfriders. Flank the packmaster and the core of the clan's power will crumble.","Defeat the Packmaster","36381","509","0","0","2","0","0"
"935","Thunderlord clan members of the Iron Horde have enslaved the mighty gronn, Durn the Hungerer. Slay him.","Slay Durn the Hungerer","36383","509","0","0","4","0","0"
"936","The time has come for you and Durotan to confront Warlord Garrosh Hellscream.","Confront Warlord Garrosh Hellscream","36385","509","0","0","6","0","0"
"937","Return to the town center.","The Calm","36202","499","0","0","4","0","0"
"938","Defeat the prisoners of The Stockade.","The Stockade","36222","510","0","35288","0","0","0"
"939","Defeat the bosses of Ragefire Chasm.","Ragefire Chasm","36226","511","0","35287","0","0","0"
"940","Defeat the inhabitants of Wailing Caverns.","Disciples of Naralex","36231","515","0","0","0","0","0"
"941","Defeat Kresh","Bonus Objective","36264","515","0","35307","2","1","0"
"942","Defeat the bosses of Shadowfang Keep.","Shadowfang Keep","36250","516","0","35304","0","0","0"
"946","Defeat Baron Silverlaine within Shadowfang Keep.","Bonus Objective: Defeat Baron Silverlaine","36260","516","0","35305","1","1","0"
"947","Defeat Commander Springvale within Shadowfang Keep.","Bonus Objective: Defeat Commander Springvale","36262","516","0","35305","2","1","0"
"948","Protect Muyoh as he performs the awakening ritual","Disciples of Naralex","36257","515","0","35303","1","0","0"
"949","Defeat Skum","Bonus Objective","36266","515","0","35307","3","1","0"
"956","Defeat the bosses of Shadowfang Keep.","Shadowfang Keep","36268","523","0","35309","0","0","0"
"957","Defeat Baron Silverlaine within Shadowfang Keep.","Bonus Objective: Defeat Baron Silverlaine","36272","523","0","35311","1","1","0"
"958","Defeat Commander Springvale within Shadowfang Keep.","Bonus Objective: Defeat Commander Springvale","36274","523","0","35311","2","1","0"
"959","Defeat the bosses of Siege of Niuzao Temple.","Siege of Niuzao Temple","36276","524","0","35312","0","0","0"
"960","Defeat the bosses of Siege of Niuzao Temple.","Siege of Niuzao Temple","36278","525","0","35461","0","0","0"
"961","Defeat the bosses of Gate of the Setting Sun.","Gate of the Setting Sun","36280","526","0","35315","0","0","0"
"962","Defeat the bosses of Gate of the Setting Sun.","Gate of the Setting Sun","36285","527","0","35316","0","0","0"
"963","Defeat the bosses of Mogu'shan Palace.","Mogu'shan Palace","36290","528","0","35318","0","0","0"
"966","Defeat the bosses of Shado-Pan Monastery.","Shado-Pan Monastery","36292","531","0","35319","0","0","0"
"970","Defeat the bosses of Shado-Pan Monastery.","Shado-Pan Monastery","36297","535","0","35320","0","0","0"
"971","Defeat the bosses of Mogu'shan Palace.","Mogu'shan Palace","36302","536","0","35321","0","0","0"
"972","Defeat the bosses of Stormstout Brewery.","Stormstout Brewery","36317","537","0","35323","0","0","0"
"973","Defeat the bosses of Stormstout Brewery.","Stormstout Brewery","36321","538","0","35324","0","0","0"
"974","Defeat the bosses within the Temple of the Jade Serpent.","Temple of the Jade Serpent","36325","539","0","35325","0","0","0"
"975","Defeat the bosses within the Temple of the Jade Serpent.","Temple of the Jade Serpent","36333","540","0","35327","0","0","0"
"976","Defeat Verdan the Everliving","Bonus Objective","36339","515","0","35307","4","1","0"
"977","Defeat the bosses of Blackrock Caverns","Blackrock Caverns","36343","542","0","35348","0","0","0"
"978","Defeat Beauty","Bonus Objective","36348","542","0","35349","1","1","0"
"983","Defeat the bosses of Blackrock Caverns.","Blackrock Caverns","36360","545","0","35351","0","0","0"
"984","Defeat Beauty.","Bonus Objective","36367","545","0","35352","1","1","0"
"987","Defeat all of the Echoes in End Time.","Defeat Echoes","36369","547","0","0","0","0","0"
"989","Defeat Murozond in End Time.","Defeat Murozond","36393","547","0","35358","1","0","0"
"990","Defeat the bosses of Throne of the Tides.","Throne of the Tides","36405","548","0","35363","0","0","0"
"991","Rescue Erunak Stonespeaker from Mindbender Ghur'sha.","Bonus Objective","36409","548","0","35364","1","1","0"
"994","Defeat the bosses of Throne of the Tides.","Throne of the Tides","36411","550","0","35365","0","0","0"
"995","Rescue Erunak Stonespeaker from Mindbender Ghur'sha.","Bonus Objective","36416","550","0","35366","1","1","0"
"996","Defeat the bosses of The Vortex Pinnacle","The Vortex Pinnacle","36420","551","0","35401","0","0","0"
"997","Defeat the bosses of The Vortex Pinnacle","The Vortex Pinnacle","36424","552","0","35403","0","0","0"
"998","Defeat the bosses of Grim Batol","Grim Batol","36428","553","0","35404","0","0","0"
"999","Defeat the bosses of Grim Batol","Grim Batol","36433","554","0","35405","0","0","0"
"1000","Defeat the bosses of the Lost City of the Tol'vir","Lost City of the Tol'vir","36457","555","0","35413","0","0","0"
"1001","Incur the wrath of Jin'do the Godbreaker.","Incur Jin'do's Wrath","36438","556","0","0","0","0","0"
"1002","Defeat Jin'do the Godbreaker.","Jin'do the Godbreaker","36444","556","0","35411","1","0","0"
"1003","Defeat the bosses of Zul'Gurub.","Bosses Defeated","36446","556","0","35412","2","1","0"
"1004","Complete the Edge of Madness event in Zul'Gurub.","The Cache of Madness","36451","556","0","35412","3","1","0"
"1005","Defeat the bosses of the Lost City of the Tol'vir","Lost City of the Tol'vir","36462","557","0","35414","0","0","0"
"1006","Defeat the bosses of the Halls of Origination","Halls of Origination","36468","558","0","35415","0","0","0"
"1008","Defeat Isiset, Construct of Magic","Bonus Objective","36474","558","0","35420","1","1","0"
"1009","Defeat Ammunae, Construct of Life","Bonus Objective","36476","558","0","35420","2","1","0"
"1010","Defeat Setesh, Construct of Destruction","Bonus Objective","36478","558","0","35420","3","1","0"
"1041","Defeat the bosses of the Halls of Origination","Halls of Origination","36500","565","0","35424","0","0","0"
"1043","Defeat Isiset, Construct of Magic","Bonus Objective","36506","565","0","35426","1","1","0"
"1044","Defeat Ammunae, Construct of Life","Bonus Objective","36508","565","0","35426","2","1","0"
"1045","Defeat Setesh, Construct of Destruction","Bonus Objective","36510","565","0","35426","3","1","0"
"1046","Defeat the bosses within The Forge of Souls","The Forge of Souls","36523","566","0","35436","0","0","0"
"1047","Assist Illidan in disabling the three demon portals.","Disable Demon Portals","36513","567","0","0","0","0","0"
"1048","Assist Illidan in slaying the demon leader.","Slay Peroth'arn","36512","567","0","0","1","0","0"
"1049","Prevent Queen Azshara from interfering with Nozdormu's plans.","Distract Queen Azshara","36518","567","0","0","2","0","0"
"1050","Assist Illidan in defeating Mannoroth.","Defeat Mannoroth","36520","567","0","35435","3","0","0"
"1051","Defeat the bosses within The Forge of Souls","The Forge of Souls","36526","568","0","35437","0","0","0"
"1053","Defeat the bosses of the Pit of Saron","Pit of Saron","36534","569","0","35438","0","0","0"
"1054","Assist Thrall in defeating the Twilight Hammer.","The Hour of Twilight","36530","570","0","35439","0","0","0"
"1055","Defeat the bosses of the Pit of Saron","Pit of Saron","36539","571","0","35440","0","0","0"
"1057","Defeat the bosses of the Halls of Reflection","Halls of Reflection","36545","572","0","35441","0","0","0"
"1058","Defeat the bosses of the Halls of Reflection","Halls of Reflection","36549","573","0","35442","0","0","0"
"1059","Defeat the bosses of Zul'Aman.","Zul'Aman","36553","574","0","35443","0","0","0"
"1060","Defeat the bosses of The Oculus","The Oculus","36560","575","0","35446","0","0","0"
"1061","Defeat the bosses of The Oculus","The Oculus","36565","576","0","35447","0","0","0"
"1062","Defeat the bosses of Utgarde Pinnacle.","Utgarde Pinnacle","36570","577","0","35449","0","0","0"
"1066","Defeat the bosses of Utgarde Pinnacle.","Utgarde Pinnacle","36576","579","0","35453","0","0","0"
"1068","Defeat the bosses within the Halls of Lightning","Halls of Lightning","36582","580","0","35456","0","0","0"
"1069","Defeat the bosses within the Halls of Lightning","Halls of Lightning","36587","581","0","35458","0","0","0"
"1070","Defeat the bosses within the Halls of Stone","Halls of Stone","36592","582","0","35465","0","0","0"
"1074","Defeat the bosses within the Halls of Stone","Halls of Stone","36602","584","0","35468","0","0","0"
"1077","Chromie has asked you to accompany Arthas in the Culling of Stratholme, you must see to it that he defeats Mal'Ganis!","A Royal Escort","36609","583","0","35472","0","0","0"
"1079","Chromie has asked you to accompany Arthas in the Culling of Stratholme, you must see to it that he defeats Mal'Ganis!","A Royal Escort","36618","585","0","35474","0","0","0"
"1080","Complete the timed event in under twenty-five minutes and defeat the Infinite Corruptor.","Infinite Corruptor Defeated","36624","585","0","35473","1","1","0"
"1081","Defeat the bosses of Gundrak","Gundrak","36626","586","0","35475","0","0","0"
"1082","Defeat the bosses of Gundrak","Gundrak","36631","587","0","35476","0","0","0"
"1083","Defeat Eck the Ferocious","Bonus Objective","36636","587","0","35477","1","1","0"
"1084","Defeat the bosses of Violet Hold","The Violet Hold","36638","588","0","35478","0","0","0"
"1085","Defeat the bosses of Violet Hold","The Violet Hold","36642","589","0","35480","0","0","0"
"1086","Defeat the bosses of Drak'Tharon Keep","Drak'Tharon Keep","36648","590","0","35483","0","0","0"
"1087","Defeat the bosses of Drak'Tharon Keep","Drak'Tharon Keep","36653","591","0","35484","0","0","0"
"1088","Defeat the bosses of Ahn'kahet: The Old Kingdom","Ahn'kahet: The Old Kingdom","36658","592","0","35489","0","0","0"
"1089","Defeat the bosses of Ahn'kahet: The Old Kingdom","Ahn'kahet: The Old Kingdom","36663","593","0","35490","0","0","0"
"1090","Defeat Amanitar","Bonus Objective","36668","593","0","35493","1","1","0"
"1091","Defeat the bosses of Azjol-Nerub.","Azjol-Nerub","36670","594","0","35497","0","0","0"
"1092","Defeat the bosses of Azjol-Nerub.","Azjol-Nerub","36674","595","0","35498","0","0","0"
"1093","Defeat the bosses of Utgarde Keep","Utgarde Keep","36678","596","0","35502","0","0","0"
"1094","Defeat the bosses of Utgarde Keep","Utgarde Keep","36682","597","0","35512","0","0","0"
"1095","Defeat the bosses of The Nexus and free Keristrasza.","Prisoner of War","36686","598","0","35513","0","0","0"
"1096","Defeat the bosses of The Nexus and free Keristrasza.","Prisoner of War","36700","599","0","35514","0","0","0"
"1097","Defeat Commander Stoutbeard.","Commander Stoutbeard defeated","36696","599","0","35515","1","1","0"
"1108","Defeat the bosses of The Nexus and free Keristrasza.","Prisoner of War","36691","605","0","35514","0","0","0"
"1109","Defeat Commander Kolurg.","Commander Kolurg defeated","36698","605","0","35515","1","1","0"
"1110","Defeat the bosses of the Shadow Labyrinth","Shadow Labyrinth","36721","606","0","35519","0","0","0"
"1111","Defeated the bosses of The Shattered Halls.","The Shattered Halls","36725","607","0","35517","0","0","0"
"1112","Defeated the bosses of The Shattered Halls.","The Shattered Halls","36729","608","0","35518","0","0","0"
"1113","Defeat the bosses of the Shadow Labyrinth","Shadow Labyrinth","36735","609","0","35520","0","0","0"
"1114","Defeat the bosses of The Black Morass","The Black Morass","36740","610","0","35521","0","0","0"
"1115","Defeat the bosses of The Black Morass","The Black Morass","36744","611","0","35522","0","0","0"
"1116","Defeat the bosses of The Botanica","The Botanica","36748","612","0","35525","0","0","0"
"1117","Defeat the bosses of The Botanica","The Botanica","36754","613","0","35526","0","0","0"
"1118","Defeat the bosses of The Mechanar","The Mechanar","36765","614","0","35528","0","0","0"
"1119","Defeat the bosses of The Mechanar","The Mechanar","36771","615","0","35529","0","0","0"
"1120","Kael'thas has risen from the ashes, he must be stopped!","Magisters' Terrace","36760","616","0","35531","0","0","0"
"1121","Kael'thas has risen from the ashes, he must be stopped!","Magisters' Terrace","36777","617","0","35532","0","0","0"
"1122","Defeat the bosses of The Steamvault","The Steamvault","36783","618","0","35533","0","0","0"
"1123","Defeat the bosses of The Steamvault","The Steamvault","36787","619","0","35534","0","0","0"
"1124","Defeat the bosses of The Arcatraz.","The Arcatraz","36791","620","0","35535","0","0","0"
"1125","Defeat the bosses of The Arcatraz.","The Arcatraz","36796","621","0","35538","0","0","0"
"1126","Defeat the bosses of Sethekk Halls","Sethekk Halls","36801","622","0","35539","0","0","0"
"1127","Defeat the bosses of Sethekk Halls","Sethekk Halls","36804","623","0","35540","0","0","0"
"1129","Defeat the bosses of Old Hillsbrad Foothills","Old Hillsbrad Foothills","36809","624","0","35542","0","0","0"
"1130","Defeat the bosses of Old Hillsbrad","Old Hillsbrad Foothills","36813","625","0","35543","0","0","0"
"1131","Defeat the bosses of Auchenai Crypts","Auchenai Crypts","36817","626","0","35544","0","0","0"
"1132","Defeat the bosses of Auchenai Crypts","Auchenai Crypts","36820","627","0","35545","0","0","0"
"1133","Defeat the bosses within Mana-Tombs","Mana-Tombs","36823","628","0","35546","0","0","0"
"1134","Defeat the bosses within Mana-Tombs","Mana-Tombs","36827","629","0","35547","0","0","0"
"1135","Defeat Yor","Bonus Objective","36831","629","0","35548","1","1","0"
"1136","Defeat the bosses of The Underbog","The Underbog","36851","630","0","35559","0","0","0"
"1137","Defeat the bosses of The Underbog","The Underbog","36856","631","0","35560","0","0","0"
"1138","Defeat the bosses of The Slave Pens","The Slave Pens","36861","632","0","35561","0","0","0"
"1139","Defeat the bosses of The Slave Pens","The Slave Pens","36865","633","0","35562","0","0","0"
"1140","Defeat the bosses of The Blood Furnace","The Blood Furnace","36877","634","0","35565","0","0","0"
"1141","Defeat the bosses of The Blood Furnace","The Blood Furnace","36883","635","0","35566","0","0","0"
"1142","Balnazzar has risen an army of vile undead slaves, we cannot let him grow this army. Kill him while we still have a chance!","The Dreadlord Balnazzar","36869","636","0","35563","0","0","0"
"1143","Defeat The Unforgiven.","The Unforgiven defeated","36871","636","0","35564","1","1","0"
"1144","Defeated Hearthsinger Forresten","Hearthsinger Forresten defeated","36873","636","0","35564","2","1","0"
"1145","Defeat Timmy the Cruel.","Timmy the Cruel defeated","36875","636","0","35564","3","1","0"
"1146","Defeat Postmaster Malown.","Postmaster Malown defeated","36881","636","0","35564","4","1","0"
"1147","Defeat Commander Malor.","Commander Malor defeated","36887","636","0","35564","5","1","0"
"1148","Defeat Willey Hopebreaker.","Willey Hopebreaker defeated","36889","636","0","35564","6","1","0"
"1149","Defeat Instructor Galford.","Instructor Galford defeated","36891","636","0","35564","7","1","0"
"1150","Destroy the Ash'ari Crystals to disable the ziggurats and gain access to the Slaughterhouse.","Disable the Ziggurats","36893","637","0","0","0","0","0"
"1151","Defeat the abominations guarding the Slaughterhouse.","The Slaughterhouse","36898","637","0","0","1","0","0"
"1152","Defeat Ramstein the Gorger.","Ramstein the Gorger","36900","637","0","0","2","0","0"
"1153","Defeat the bosses in Hellfire Ramparts","Hellfire Ramparts","36904","638","0","35572","0","0","0"
"1154","Defeat the bosses in Hellfire Ramparts","Hellfire Ramparts","36914","639","0","35573","0","0","0"
"1155","Defeat the Black Guard Sentries and proceed into Lord Aurius Rivendare's domain.","Lord Aurius Rivendare","36910","637","0","35574","3","0","0"
"1156","Defeat Magistrate Barthilas.","Magistrate Barthilas defeated","36918","637","0","35575","4","1","0"
"1157","Defeat the bosses of the Temple of Atal'hakkar","The Temple of Atal'hakkar","36922","640","0","35582","0","0","0"
"1161","Defeat the bosses of the Deadmines.","The Deadmines","36936","641","0","35586","0","0","0"
"1163","Defeat the bosses of the Deadmines.","The Deadmines","36942","643","0","35587","0","0","0"
"1164","Defeat the bosses of Zul'Farrak","Zul'Farrak","36949","644","0","35588","0","0","0"
"1165","Defeat Antu'sul","Bonus Objective","36953","644","0","35589","1","1","0"
"1166","Defeat Theka the Martyr","Bonus Objective","36955","644","0","35589","2","1","0"
"1167","Defeat Witch Doctor Zum'rah","Bonus Objective","36957","644","0","35589","3","1","0"
"1168","Defeat Hydromancer Velratha","Bonus Objective","36959","644","0","35589","4","1","0"
"1169","Defeat Gahz'rilla","Bonus Objective","36961","644","0","35589","5","1","0"
"1170","The key to lifting the curse of this place rests in the final death of Darkmaster Gandling.","Scholomance","36963","645","0","35594","0","0","0"
"1171","The key to lifting the curse of this place rests in the final death of Darkmaster Gandling.","Scholomance","36971","646","0","35595","0","0","0"
"1172","Defeat Blackthorn's Lieutenants","Blackthorn's Lieutenants","36977","647","0","0","0","0","0"
"1173","Defeat Death Speaker Blackthorn","Death Speaker Blackthorn","36984","647","0","0","1","0","0"
"1174","Defeat Amnennar the Coldbringer","Amnennar the Coldbringer","36982","647","0","35598","2","0","0"
"1175","Defeat the bosses of Uldaman","Uldaman","37023","648","0","35605","0","0","0"
"1176","Defeat Mekgineer Thermaplugg.","Gnomeregan","36986","649","0","35601","0","0","0"
"1177","Defeat Grubbis.","Grubbis defeated","36988","649","0","35602","1","1","0"
"1178","Defeat Viscous Fallout.","Viscous Fallout defeated","36990","649","0","35602","2","1","0"
"1179","Defeat Electrocutioner 6000.","Electrocutioner 6000 defeated","36992","649","0","35602","3","1","0"
"1180","Defeat Crowd Pummeler 9-60.","Crowd Pummeler 9-60 defeated","36994","649","0","35602","4","1","0"
"1181","Defeat the bosses of the Scarlet Halls.","Scarlet Halls","37018","650","0","35606","0","0","0"
"1182","Defeat Armsmaster Harlan.","Armsmaster Harlan defeated","37021","650","0","35607","1","1","0"
"1183","Defeat the Obsidian Sentinel","Bonus Objective","37030","648","0","35610","1","1","0"
"1184","Defeat the Ancient Stone Keeper","Bonus Objective","37032","648","0","35610","2","1","0"
"1185","Defeat Galgann Firehammer","Bonus Objective","37034","648","0","35610","3","1","0"
"1186","Defeat the bosses of the Scarlet Halls.","Scarlet Halls","37027","651","0","35608","0","0","0"
"1187","Defeat Armsmaster Harlan.","Armsmaster Harlan defeated","37036","651","0","35609","1","1","0"
"1188","Defeat Grimlok","Bonus Objective","37038","648","0","35610","4","1","0"
"1189","Send High Inquisitor Whitemane to her final rest and put an end to the Scarlet Crusade.","Scarlet Monastery","37040","652","0","35612","0","0","0"
"1190","Send High Inquisitor Whitemane to her final rest and put an end to the Scarlet Crusade.","Scarlet Monastery","37045","653","0","35613","0","0","0"
"1191","Defeat the bosses of Razorfen Kraul","Razorfen Kraul","37050","654","0","35615","0","0","0"
"1196","Bronze: Earn 300 Points","Bronze","37139","499","0","0","6","1","0"
"1197","Silver: Earn 600 Points","Silver","37141","499","1196","0","7","1","0"
"1198","Gold: Earn 1000 Points","Gold","37143","499","1197","0","8","1","0"
"1199","Defeat the bosses of The Wicked Grotto","The Wicked Grotto","37162","661","0","35885","0","0","0"
"1200","Defeat the bosses of Foulspore Caverns","Foulspore Caverns","37166","662","0","35886","0","0","0"
"1201","Defeat the bosses of Earth Song Falls","Earth Song Falls","37169","663","0","35887","0","0","0"
"1202","Defeat the bosses of Maraudon","Maraudon","37173","664","0","35888","0","0","0"
"1203","Defeat Rotgrip","Bonus Objective","37182","663","0","35889","1","1","0"
"1205","Defeat Rotgrip","Bonus Objective","37184","664","0","35889","1","1","0"
"1206","Defeat the bosses of the Warpwood Quarter","Warpwood Quarter","37186","665","0","35890","0","0","0"
"1207","Defeat the bosses of the Capital Gardens","Capital Gardens","37191","666","0","35891","0","0","0"
"1208","Defeat Prince Tortheldrin","Bonus Objective","37197","666","0","35894","1","1","0"
"1209","Defeat the bosses of the Gordok Commons","Gordok Commons","37199","667","0","35892","0","0","0"
"1210","Defeat Stomper Kreeg","Bonus Objective","37205","667","0","35894","1","1","0"
"1211","Defeat Cho'Rush the Observer","Bonus Objective","37223","667","0","35894","2","1","0"
"1212","Defeat the bosses of Dire Maul","Dire Maul","37208","668","0","35956","0","0","0"
"1213","Defeat Stomper Kreeg","Bonus Objective","37225","668","0","35894","1","1","0"
"1214","Defeat Cho'Rush the Observer","Bonus Objective","37227","668","0","35894","2","1","0"
"1215","Defeat Prince Tortheldrin","Bonus Objective","37229","668","0","35894","3","1","0"
"1216","Defeat the bosses in the Detention Block","Detention Block","37231","669","0","35899","0","0","0"
"1217","Defeat the bosses of Upper City","Upper City","37240","670","0","35902","0","0","0"
"1218","Defeat the bosses of Blackrock Depths","Blackrock Depths","37245","671","0","35904","0","0","0"
"1219","Complete the Ring of Law","Ring of Law","37234","669","0","35901","1","1","0"
"1220","Defeat High Interrogator Gerstahn","High Interrogator Gerstahn","37236","669","0","35901","2","1","0"
"1221","Defeat Bael'Gar","Bael'Gar","37238","669","0","35901","3","1","0"
"1224","","Ring of Law","37248","671","0","35903","1","1","0"
"1225","Defeat High Interrogator Gerstahn","High Interrogator Gerstahn","37250","671","0","35903","2","1","0"
"1226","Defeat Bael'Gar","Bael'Gar","37252","671","0","35903","3","1","0"
"1228","Defeat the bosses in the Grim Guzzler","The Grim Guzzler","37257","671","0","35903","4","1","0"
"1229","Defeat Phalanx","Phalanx","37265","671","0","35903","5","1","0"
"1230","The timer should start here.","Start Timer","37267","673","0","0","0","0","0"
"1231","You got past the timer","Timer Over","37269","673","0","35142","1","0","0"
"1232","Defeat the bosses of The Stonecore","The Stonecore","37271","674","0","35911","0","0","0"
"1233","Defeat the bosses of The Stonecore","The Stonecore","37276","675","0","35913","0","0","0"
"1234","Defeat the Grand Champions","Grand Champions","37298","676","0","0","0","0","0"
"1235","Overcome the second Argent trial","Argent Trial","37300","676","0","0","1","0","0"
"1236","Defeat The Black Knight","The Black Knight","37303","676","0","35950","2","0","0"
"1237","Defeat the Grand Champions","Grand Champions","37305","677","0","0","0","0","0"
"1238","Overcome the second Argent Trial","Argent Trial","37307","677","0","0","1","0","0"
"1239","Defeat the Black Knight","The Black Knight","37310","677","0","35950","2","0","0"
"1240","Root out the corruption within Auchindoun.","Auchindoun","37312","678","0","35960","0","0","0"
"1241","Root out the corruption within Auchindoun.","Auchindoun","37317","679","0","35963","0","0","0"
"1242","Defeat the Bloodmaul slavers operating the Slag Mines.","Bloodmaul Slag Mines","37322","680","0","35957","0","0","0"
"1245","Defeat the Bloodmaul slavers operating the Slag Mines.","Bloodmaul Slag Mines","37329","681","0","35963","0","0","0"
"1248","Fight your way through the Depot to board the Grimrail.","Grimrail Depot","37336","682","0","0","0","0","0"
"1249","","The Grimrail","37338","682","0","35962","1","0","0"
"1250","Fight your way through the Depot to board the Grimrail.","Grimrail Depot","37341","683","0","0","0","0","0"
"1251","","The Grimrail","37343","683","0","35963","1","0","0"
"1252","Disrupt the Iron Horde's naval forces.","Iron Docks","37346","684","0","35958","0","0","0"
"1253","Disrupt the Iron Horde's naval forces.","Iron Docks","37351","685","0","35963","0","0","0"
"1254","Defeat the bosses of the Shadowmoon Burial Grounds","Shadowmoon Burial Grounds","37356","686","0","35962","0","0","0"
